
         /\      Grafana   /‾‾/  
    /\  /  \     |\  __   /  /   
   /  \/    \    | |/ /  /   ‾‾\ 
  /          \   |   (  |  (‾)  |
 / __________ \  |_|\_\  \_____/ 

     execution: local
        script: /work/k6_smoke.js
        output: -

     scenarios: (100.00%) 1 scenario, 20 max VUs, 2m30s max duration (incl. graceful stop):
              * default: Up to 20 looping VUs for 2m0s over 3 stages (gracefulRampDown: 30s, gracefulStop: 30s)


running (0m01.0s), 01/20 VUs, 0 complete and 0 interrupted iterations
default   [   1% ] 01/20 VUs  0m01.0s/2m00.0s

running (0m02.0s), 01/20 VUs, 1 complete and 0 interrupted iterations
default   [   2% ] 01/20 VUs  0m02.0s/2m00.0s

running (0m03.0s), 01/20 VUs, 2 complete and 0 interrupted iterations
default   [   2% ] 01/20 VUs  0m03.0s/2m00.0s

running (0m04.0s), 01/20 VUs, 3 complete and 0 interrupted iterations
default   [   3% ] 01/20 VUs  0m04.0s/2m00.0s

running (0m05.0s), 01/20 VUs, 4 complete and 0 interrupted iterations
default   [   4% ] 01/20 VUs  0m05.0s/2m00.0s

running (0m06.0s), 01/20 VUs, 5 complete and 0 interrupted iterations
default   [   5% ] 01/20 VUs  0m06.0s/2m00.0s

running (0m07.0s), 01/20 VUs, 6 complete and 0 interrupted iterations
default   [   6% ] 01/20 VUs  0m07.0s/2m00.0s

running (0m08.0s), 02/20 VUs, 7 complete and 0 interrupted iterations
default   [   7% ] 02/20 VUs  0m08.0s/2m00.0s

running (0m09.0s), 02/20 VUs, 9 complete and 0 interrupted iterations
default   [   7% ] 02/20 VUs  0m09.0s/2m00.0s

running (0m10.0s), 02/20 VUs, 11 complete and 0 interrupted iterations
default   [   8% ] 02/20 VUs  0m10.0s/2m00.0s

running (0m11.0s), 02/20 VUs, 13 complete and 0 interrupted iterations
default   [   9% ] 02/20 VUs  0m11.0s/2m00.0s

running (0m12.0s), 02/20 VUs, 15 complete and 0 interrupted iterations
default   [  10% ] 02/20 VUs  0m12.0s/2m00.0s

running (0m13.0s), 02/20 VUs, 17 complete and 0 interrupted iterations
default   [  11% ] 02/20 VUs  0m13.0s/2m00.0s

running (0m14.0s), 02/20 VUs, 19 complete and 0 interrupted iterations
default   [  12% ] 02/20 VUs  0m14.0s/2m00.0s

running (0m15.0s), 02/20 VUs, 21 complete and 0 interrupted iterations
default   [  12% ] 02/20 VUs  0m15.0s/2m00.0s

running (0m16.0s), 03/20 VUs, 23 complete and 0 interrupted iterations
default   [  13% ] 03/20 VUs  0m16.0s/2m00.0s

running (0m17.0s), 03/20 VUs, 26 complete and 0 interrupted iterations
default   [  14% ] 03/20 VUs  0m17.0s/2m00.0s

running (0m18.0s), 03/20 VUs, 29 complete and 0 interrupted iterations
default   [  15% ] 03/20 VUs  0m18.0s/2m00.0s

running (0m19.0s), 03/20 VUs, 32 complete and 0 interrupted iterations
default   [  16% ] 03/20 VUs  0m19.0s/2m00.0s

running (0m20.0s), 03/20 VUs, 35 complete and 0 interrupted iterations
default   [  17% ] 03/20 VUs  0m20.0s/2m00.0s

running (0m21.0s), 03/20 VUs, 38 complete and 0 interrupted iterations
default   [  17% ] 03/20 VUs  0m21.0s/2m00.0s

running (0m22.0s), 03/20 VUs, 41 complete and 0 interrupted iterations
default   [  18% ] 03/20 VUs  0m22.0s/2m00.0s

running (0m23.0s), 04/20 VUs, 44 complete and 0 interrupted iterations
default   [  19% ] 04/20 VUs  0m23.0s/2m00.0s

running (0m24.0s), 04/20 VUs, 48 complete and 0 interrupted iterations
default   [  20% ] 04/20 VUs  0m24.0s/2m00.0s

running (0m25.0s), 04/20 VUs, 52 complete and 0 interrupted iterations
default   [  21% ] 04/20 VUs  0m25.0s/2m00.0s

running (0m26.0s), 04/20 VUs, 56 complete and 0 interrupted iterations
default   [  22% ] 04/20 VUs  0m26.0s/2m00.0s

running (0m27.0s), 04/20 VUs, 60 complete and 0 interrupted iterations
default   [  22% ] 04/20 VUs  0m27.0s/2m00.0s

running (0m28.0s), 04/20 VUs, 64 complete and 0 interrupted iterations
default   [  23% ] 04/20 VUs  0m28.0s/2m00.0s

running (0m29.0s), 04/20 VUs, 68 complete and 0 interrupted iterations
default   [  24% ] 04/20 VUs  0m29.0s/2m00.0s

running (0m30.0s), 04/20 VUs, 72 complete and 0 interrupted iterations
default   [  25% ] 04/20 VUs  0m30.0s/2m00.0s

running (0m31.0s), 05/20 VUs, 76 complete and 0 interrupted iterations
default   [  26% ] 05/20 VUs  0m31.0s/2m00.0s

running (0m32.0s), 05/20 VUs, 81 complete and 0 interrupted iterations
default   [  27% ] 05/20 VUs  0m32.0s/2m00.0s

running (0m33.0s), 05/20 VUs, 86 complete and 0 interrupted iterations
default   [  27% ] 05/20 VUs  0m33.0s/2m00.0s

running (0m34.0s), 05/20 VUs, 91 complete and 0 interrupted iterations
default   [  28% ] 05/20 VUs  0m34.0s/2m00.0s

running (0m35.0s), 06/20 VUs, 96 complete and 0 interrupted iterations
default   [  29% ] 06/20 VUs  0m35.0s/2m00.0s

running (0m36.0s), 06/20 VUs, 102 complete and 0 interrupted iterations
default   [  30% ] 06/20 VUs  0m36.0s/2m00.0s

running (0m37.0s), 06/20 VUs, 108 complete and 0 interrupted iterations
default   [  31% ] 06/20 VUs  0m37.0s/2m00.0s

running (0m38.0s), 06/20 VUs, 114 complete and 0 interrupted iterations
default   [  32% ] 06/20 VUs  0m38.0s/2m00.0s

running (0m39.0s), 07/20 VUs, 120 complete and 0 interrupted iterations
default   [  32% ] 07/20 VUs  0m39.0s/2m00.0s

running (0m40.0s), 07/20 VUs, 127 complete and 0 interrupted iterations
default   [  33% ] 07/20 VUs  0m40.0s/2m00.0s

running (0m41.0s), 07/20 VUs, 134 complete and 0 interrupted iterations
default   [  34% ] 07/20 VUs  0m41.0s/2m00.0s

running (0m42.0s), 07/20 VUs, 141 complete and 0 interrupted iterations
default   [  35% ] 07/20 VUs  0m42.0s/2m00.0s

running (0m43.0s), 08/20 VUs, 148 complete and 0 interrupted iterations
default   [  36% ] 08/20 VUs  0m43.0s/2m00.0s

running (0m44.0s), 08/20 VUs, 156 complete and 0 interrupted iterations
default   [  37% ] 08/20 VUs  0m44.0s/2m00.0s

running (0m45.0s), 08/20 VUs, 164 complete and 0 interrupted iterations
default   [  37% ] 08/20 VUs  0m45.0s/2m00.0s

running (0m46.0s), 08/20 VUs, 172 complete and 0 interrupted iterations
default   [  38% ] 08/20 VUs  0m46.0s/2m00.0s

running (0m47.0s), 09/20 VUs, 180 complete and 0 interrupted iterations
default   [  39% ] 09/20 VUs  0m47.0s/2m00.0s

running (0m48.0s), 09/20 VUs, 189 complete and 0 interrupted iterations
default   [  40% ] 09/20 VUs  0m48.0s/2m00.0s

running (0m49.0s), 09/20 VUs, 198 complete and 0 interrupted iterations
default   [  41% ] 09/20 VUs  0m49.0s/2m00.0s

running (0m50.0s), 09/20 VUs, 207 complete and 0 interrupted iterations
default   [  42% ] 09/20 VUs  0m50.0s/2m00.0s

running (0m51.0s), 10/20 VUs, 216 complete and 0 interrupted iterations
default   [  42% ] 10/20 VUs  0m51.0s/2m00.0s

running (0m52.0s), 10/20 VUs, 226 complete and 0 interrupted iterations
default   [  43% ] 10/20 VUs  0m52.0s/2m00.0s

running (0m53.0s), 10/20 VUs, 236 complete and 0 interrupted iterations
default   [  44% ] 10/20 VUs  0m53.0s/2m00.0s

running (0m54.0s), 10/20 VUs, 246 complete and 0 interrupted iterations
default   [  45% ] 10/20 VUs  0m54.0s/2m00.0s

running (0m55.0s), 11/20 VUs, 256 complete and 0 interrupted iterations
default   [  46% ] 11/20 VUs  0m55.0s/2m00.0s

running (0m56.0s), 11/20 VUs, 267 complete and 0 interrupted iterations
default   [  47% ] 11/20 VUs  0m56.0s/2m00.0s

running (0m57.0s), 11/20 VUs, 278 complete and 0 interrupted iterations
default   [  47% ] 11/20 VUs  0m57.0s/2m00.0s

running (0m58.0s), 11/20 VUs, 289 complete and 0 interrupted iterations
default   [  48% ] 11/20 VUs  0m58.0s/2m00.0s

running (0m59.0s), 12/20 VUs, 300 complete and 0 interrupted iterations
default   [  49% ] 12/20 VUs  0m59.0s/2m00.0s

running (1m00.0s), 12/20 VUs, 312 complete and 0 interrupted iterations
default   [  50% ] 12/20 VUs  1m00.0s/2m00.0s

running (1m01.0s), 12/20 VUs, 324 complete and 0 interrupted iterations
default   [  51% ] 12/20 VUs  1m01.0s/2m00.0s

running (1m02.0s), 12/20 VUs, 336 complete and 0 interrupted iterations
default   [  52% ] 12/20 VUs  1m02.0s/2m00.0s

running (1m03.0s), 13/20 VUs, 348 complete and 0 interrupted iterations
default   [  52% ] 13/20 VUs  1m03.0s/2m00.0s

running (1m04.0s), 13/20 VUs, 361 complete and 0 interrupted iterations
default   [  53% ] 13/20 VUs  1m04.0s/2m00.0s

running (1m05.0s), 13/20 VUs, 374 complete and 0 interrupted iterations
default   [  54% ] 13/20 VUs  1m05.0s/2m00.0s

running (1m06.0s), 13/20 VUs, 387 complete and 0 interrupted iterations
default   [  55% ] 13/20 VUs  1m06.0s/2m00.0s

running (1m07.0s), 14/20 VUs, 400 complete and 0 interrupted iterations
default   [  56% ] 14/20 VUs  1m07.0s/2m00.0s

running (1m08.0s), 14/20 VUs, 414 complete and 0 interrupted iterations
default   [  57% ] 14/20 VUs  1m08.0s/2m00.0s

running (1m09.0s), 14/20 VUs, 428 complete and 0 interrupted iterations
default   [  57% ] 14/20 VUs  1m09.0s/2m00.0s

running (1m10.0s), 14/20 VUs, 442 complete and 0 interrupted iterations
default   [  58% ] 14/20 VUs  1m10.0s/2m00.0s

running (1m11.0s), 15/20 VUs, 456 complete and 0 interrupted iterations
default   [  59% ] 15/20 VUs  1m11.0s/2m00.0s

running (1m12.0s), 15/20 VUs, 471 complete and 0 interrupted iterations
default   [  60% ] 15/20 VUs  1m12.0s/2m00.0s

running (1m13.0s), 15/20 VUs, 486 complete and 0 interrupted iterations
default   [  61% ] 15/20 VUs  1m13.0s/2m00.0s

running (1m14.0s), 15/20 VUs, 501 complete and 0 interrupted iterations
default   [  62% ] 15/20 VUs  1m14.0s/2m00.0s

running (1m15.0s), 16/20 VUs, 516 complete and 0 interrupted iterations
default   [  62% ] 16/20 VUs  1m15.0s/2m00.0s

running (1m16.0s), 16/20 VUs, 532 complete and 0 interrupted iterations
default   [  63% ] 16/20 VUs  1m16.0s/2m00.0s

running (1m17.0s), 16/20 VUs, 548 complete and 0 interrupted iterations
default   [  64% ] 16/20 VUs  1m17.0s/2m00.0s

running (1m18.0s), 16/20 VUs, 564 complete and 0 interrupted iterations
default   [  65% ] 16/20 VUs  1m18.0s/2m00.0s

running (1m19.0s), 17/20 VUs, 580 complete and 0 interrupted iterations
default   [  66% ] 17/20 VUs  1m19.0s/2m00.0s

running (1m20.0s), 17/20 VUs, 597 complete and 0 interrupted iterations
default   [  67% ] 17/20 VUs  1m20.0s/2m00.0s

running (1m21.0s), 17/20 VUs, 614 complete and 0 interrupted iterations
default   [  67% ] 17/20 VUs  1m21.0s/2m00.0s

running (1m22.0s), 17/20 VUs, 631 complete and 0 interrupted iterations
default   [  68% ] 17/20 VUs  1m22.0s/2m00.0s

running (1m23.0s), 18/20 VUs, 648 complete and 0 interrupted iterations
default   [  69% ] 18/20 VUs  1m23.0s/2m00.0s

running (1m24.0s), 18/20 VUs, 666 complete and 0 interrupted iterations
default   [  70% ] 18/20 VUs  1m24.0s/2m00.0s

running (1m25.0s), 18/20 VUs, 684 complete and 0 interrupted iterations
default   [  71% ] 18/20 VUs  1m25.0s/2m00.0s

running (1m26.0s), 18/20 VUs, 702 complete and 0 interrupted iterations
default   [  72% ] 18/20 VUs  1m26.0s/2m00.0s

running (1m27.0s), 19/20 VUs, 720 complete and 0 interrupted iterations
default   [  72% ] 19/20 VUs  1m27.0s/2m00.0s

running (1m28.0s), 19/20 VUs, 739 complete and 0 interrupted iterations
default   [  73% ] 19/20 VUs  1m28.0s/2m00.0s

running (1m29.0s), 19/20 VUs, 758 complete and 0 interrupted iterations
default   [  74% ] 19/20 VUs  1m29.0s/2m00.0s

running (1m30.0s), 19/20 VUs, 777 complete and 0 interrupted iterations
default   [  75% ] 19/20 VUs  1m30.0s/2m00.0s

running (1m31.0s), 20/20 VUs, 796 complete and 0 interrupted iterations
default   [  76% ] 20/20 VUs  1m31.0s/2m00.0s

running (1m32.0s), 20/20 VUs, 816 complete and 0 interrupted iterations
default   [  77% ] 20/20 VUs  1m32.0s/2m00.0s

running (1m33.0s), 19/20 VUs, 836 complete and 0 interrupted iterations
default   [  77% ] 19/20 VUs  1m33.0s/2m00.0s

running (1m34.0s), 18/20 VUs, 855 complete and 0 interrupted iterations
default   [  78% ] 18/20 VUs  1m34.0s/2m00.0s

running (1m35.0s), 18/20 VUs, 873 complete and 0 interrupted iterations
default   [  79% ] 18/20 VUs  1m35.0s/2m00.0s

running (1m36.0s), 17/20 VUs, 891 complete and 0 interrupted iterations
default   [  80% ] 17/20 VUs  1m36.0s/2m00.0s

running (1m37.0s), 16/20 VUs, 908 complete and 0 interrupted iterations
default   [  81% ] 16/20 VUs  1m37.0s/2m00.0s

running (1m38.0s), 16/20 VUs, 924 complete and 0 interrupted iterations
default   [  82% ] 16/20 VUs  1m38.0s/2m00.0s

running (1m39.0s), 15/20 VUs, 940 complete and 0 interrupted iterations
default   [  82% ] 15/20 VUs  1m39.0s/2m00.0s

running (1m40.0s), 14/20 VUs, 955 complete and 0 interrupted iterations
default   [  83% ] 14/20 VUs  1m40.0s/2m00.0s

running (1m41.0s), 14/20 VUs, 969 complete and 0 interrupted iterations
default   [  84% ] 14/20 VUs  1m41.0s/2m00.0s

running (1m42.0s), 13/20 VUs, 983 complete and 0 interrupted iterations
default   [  85% ] 13/20 VUs  1m42.0s/2m00.0s

running (1m43.0s), 12/20 VUs, 996 complete and 0 interrupted iterations
default   [  86% ] 12/20 VUs  1m43.0s/2m00.0s

running (1m44.0s), 12/20 VUs, 1008 complete and 0 interrupted iterations
default   [  87% ] 12/20 VUs  1m44.0s/2m00.0s

running (1m45.0s), 11/20 VUs, 1020 complete and 0 interrupted iterations
default   [  87% ] 11/20 VUs  1m45.0s/2m00.0s

running (1m46.0s), 10/20 VUs, 1031 complete and 0 interrupted iterations
default   [  88% ] 10/20 VUs  1m46.0s/2m00.0s

running (1m47.0s), 10/20 VUs, 1041 complete and 0 interrupted iterations
default   [  89% ] 10/20 VUs  1m47.0s/2m00.0s

running (1m48.0s), 09/20 VUs, 1051 complete and 0 interrupted iterations
default   [  90% ] 09/20 VUs  1m48.0s/2m00.0s

running (1m49.0s), 08/20 VUs, 1060 complete and 0 interrupted iterations
default   [  91% ] 08/20 VUs  1m49.0s/2m00.0s

running (1m50.0s), 08/20 VUs, 1068 complete and 0 interrupted iterations
default   [  92% ] 08/20 VUs  1m50.0s/2m00.0s

running (1m51.0s), 07/20 VUs, 1076 complete and 0 interrupted iterations
default   [  92% ] 07/20 VUs  1m51.0s/2m00.0s

running (1m52.0s), 06/20 VUs, 1083 complete and 0 interrupted iterations
default   [  93% ] 06/20 VUs  1m52.0s/2m00.0s

running (1m53.0s), 06/20 VUs, 1089 complete and 0 interrupted iterations
default   [  94% ] 06/20 VUs  1m53.0s/2m00.0s

running (1m54.0s), 05/20 VUs, 1095 complete and 0 interrupted iterations
default   [  95% ] 05/20 VUs  1m54.0s/2m00.0s

running (1m55.0s), 04/20 VUs, 1100 complete and 0 interrupted iterations
default   [  96% ] 04/20 VUs  1m55.0s/2m00.0s

running (1m56.0s), 03/20 VUs, 1104 complete and 0 interrupted iterations
default   [  97% ] 03/20 VUs  1m56.0s/2m00.0s

running (1m57.0s), 03/20 VUs, 1107 complete and 0 interrupted iterations
default   [  97% ] 03/20 VUs  1m57.0s/2m00.0s

running (1m58.0s), 02/20 VUs, 1110 complete and 0 interrupted iterations
default   [  98% ] 02/20 VUs  1m58.0s/2m00.0s

running (1m59.0s), 01/20 VUs, 1112 complete and 0 interrupted iterations
default   [  99% ] 01/20 VUs  1m59.0s/2m00.0s

running (2m00.0s), 01/20 VUs, 1113 complete and 0 interrupted iterations
default   [ 100% ] 01/20 VUs  2m00.0s/2m00.0s


  █ THRESHOLDS 

    http_req_duration
    ✓ 'p(95)<800' p(95)=0s

    http_req_failed
    ✗ 'rate<0.01' rate=100.00%


  █ TOTAL RESULTS 

    checks_total.......: 1114    9.275146/s
    checks_succeeded...: 0.00%   0 out of 1114
    checks_failed......: 100.00% 1114 out of 1114

    ✗ ping 200
      ↳  0% — ✓ 0 / ✗ 1114

    HTTP
    http_req_duration....: avg=0s min=0s med=0s max=0s p(90)=0s p(95)=0s
    http_req_failed......: 100.00% 1114 out of 1114
    http_reqs............: 1114    9.275146/s

    EXECUTION
    iteration_duration...: avg=1s min=1s med=1s max=1s p(90)=1s p(95)=1s
    iterations...........: 1114    9.275146/s
    vus..................: 1       min=1            max=20
    vus_max..............: 20      min=20           max=20

    NETWORK
    data_received........: 0 B     0 B/s
    data_sent............: 0 B     0 B/s




running (2m00.1s), 00/20 VUs, 1114 complete and 0 interrupted iterations
default ✓ [ 100% ] 00/20 VUs  2m0s
